{
  "package_id": "ZT-SCH-001",
  "schedule_id": "ZTSCH-DAILY-001",
  "evidence_type": "SCHEDULE_CONFIGURATION",
  "evidence_authority": "USER_APPROVED_CODEX_EXECUTION",
  "captured_at": "2026-08-11T12:09:48.6005045Z",
  "approval_reference": "USER_APPROVED_ZT_SCH_001_UPDATE_2026-08-11_FIX_REQUEST",
  "platform": "WINDOWS_TASK_SCHEDULER",
  "definition": {
    "task_path": "\\SNSD Zero Trust\\",
    "task_name": "SNSD-ZT-SCH-001-Daily",
    "state": "READY",
    "enabled": true,
    "trigger": "DAILY",
    "interval_days": 1,
    "daily_start_time_local": "09:00:00",
    "time_zone": "Asia/Seoul",
    "next_run_time": "2026-08-12T00:00:00Z",
    "definition_status": "MATCHED"
  },
  "principal": {
    "logon_type": "INTERACTIVE_TOKEN",
    "run_level": "LIMITED",
    "credential_stored": false,
    "account_value_recorded": false
  },
  "runtime_controls": {
    "multiple_instances": "IGNORE_NEW",
    "exclusive_lock": true,
    "one_attempt_per_local_date": true,
    "execution_time_limit": "PT20M",
    "child_time_limit": "PT15M",
    "start_when_available": true,
    "catch_up": true,
    "catch_up_window": "PT2H",
    "restart_count": 0,
    "automatic_retry": false,
    "automatic_remediation": false,
    "infrastructure_mutation": false,
    "repository_mutation": false,
    "history_auto_append": false
  },
  "schedule_fingerprint": "15fc9daf36b5667d1a11b2175b438455e99ed70ee7f6b42a242904e7a3bfa283",
  "runtime_execution_performed": false,
  "successful_scheduled_executions": 0,
  "successful_distinct_scheduled_dates": 0,
  "current_continuity": "EC4_REPEATABLE_RUNTIME",
  "target_continuity": "EC5_SCHEDULED_RUNTIME",
  "result": "PASS_CONFIGURATION",
  "secret_findings": 0,
  "privacy_findings": 0,
  "limitations": [
    "This bounded configuration update did not execute the live validator and is not scheduled-runtime evidence.",
    "Six prior sanitized scheduled candidates failed; zero successful correlated dates are accepted.",
    "The task runs only when the approved current-user interactive session and lab targets become available by 11:00 local time.",
    "No EC5, continuous observation, maturity, compliance, certification, or Phase 1 completion is claimed."
  ]
}
